{
 "snapshot_date": "2026-06-09",
 "upstream": {
  "repository": "w3c/sustainableweb-wsg",
  "guidelines_last_modified": "2026-06-09",
  "star_last_modified": "2026-06-09",
  "edition": "Group Note Draft"
 },
 "fetched_at": "2026-07-03T12:37:25.045Z",
 "tool_version": "0.1.0",
 "counts": {
  "sections": 4,
  "guidelines": 71,
  "criteria": 196,
  "star_techniques": 117,
  "star_unlinked": 1
 },
 "star_unlinked_techniques": [
  "compatibility-documentation"
 ]
}